[
  {
    "app_name": "telegram-wallet",
    "name": "Walt (ex. Wallet)",
    "image": "https://wallet.tg/images/logo-288.png",
    "about_url": "https://walt.io/",
    "universal_url": "https://t.me/wallet?attach=wallet",
    "bridge": [
      {
        "type": "sse",
        "url": "https://walletbot.me/tonconnect-bridge/bridge"
      }
    ],
    "platforms": ["ios", "android", "macos", "windows", "linux"],
    "features": [
      {
        "name": "SendTransaction",
        "maxMessages": 255,
        "extraCurrencySupported": true
      },
      {
        "name": "SignData",
        "types": ["text", "binary", "cell"]
      }
    ]
  },
  {
    "app_name": "gramwallet",
    "name": "Gram Wallet",
    "image": "https://static.gramwallet.io/gramwallet/icon-288.png",
    "about_url": "https://gramwallet.io",
    "universal_url": "https://connect.gramwallet.io",
    "deepLink": "gramwallet-tc://",
    "bridge": [
      {
        "type": "js",
        "key": "gramwallet"
      },
      {
        "type": "sse",
        "url": "https://tonconnectbridge.mytonwallet.org/bridge/"
      }
    ],
    "platforms": [
      "ios",
      "android"
    ],
    "features": [
      {
        "name": "SendTransaction",
        "maxMessages": 255,
        "extraCurrencySupported": false
      },
      {
        "name": "SignData",
        "types": ["text", "binary", "cell"]
      }
    ]
  },
  {
    "app_name": "tonkeeper",
    "name": "Keeper",
    "image": "https://tonkeeper.com/assets/tonconnect-icon.png",
    "tondns": "tonkeeper.ton",
    "about_url": "https://tonkeeper.com",
    "universal_url": "https://app.tonkeeper.com/ton-connect",
    "deepLink": "tonkeeper-tc://",
    "bridge": [
      {
        "type": "sse",
        "url": "https://bridge.tonapi.io/bridge"
      },
      {
        "type": "js",
        "key": "tonkeeper"
      }
    ],
    "platforms": ["ios", "android", "chrome", "firefox", "macos", "windows", "linux"],
    "features": [
      {
        "name": "SendTransaction",
        "maxMessages": 255,
        "extraCurrencySupported": true
      },
      {
        "name": "SignData",
        "types": ["text", "binary", "cell"]
      }
    ]
  },
  {
    "app_name": "mytonwallet",
    "name": "My Wallet",
    "image": "https://static.mywallet.io/mywallet/icon-288.png",
    "about_url": "https://mywallet.io/?utm_source=tc",
    "universal_url": "https://connect.mytonwallet.org",
    "deepLink": "mytonwallet-tc://",
    "bridge": [
      {
        "type": "js",
        "key": "mytonwallet"
      },
      {
        "type": "sse",
        "url": "https://tonconnectbridge.mytonwallet.org/bridge/"
      }
    ],
    "platforms": [
      "chrome",
      "windows",
      "macos",
      "linux",
      "ios",
      "android",
      "firefox"
    ],
    "features": [
      {
        "name": "SendTransaction",
        "maxMessages": 255,
        "extraCurrencySupported": false
      },
      {
        "name": "SignData",
        "types": ["text", "binary", "cell"]
      }
    ]
  },
  {
    "app_name": "tonhub",
    "name": "Tonhub",
    "image": "https://tonhub.com/tonconnect_logo.png",
    "about_url": "https://tonhub.com",
    "universal_url": "https://tonhub.com/ton-connect",
    "bridge": [
      {
        "type": "js",
        "key": "tonhub"
      },
      {
        "type": "sse",
        "url": "https://connect.tonhubapi.com/tonconnect"
      }
    ],
    "platforms": ["ios", "android"],
    "features": [
      {
        "name": "SendTransaction",
        "maxMessages": 255,
        "extraCurrencySupported": true
      },
      {
        "name": "SignData",
        "types": ["text", "binary", "cell"]
      }
    ]
  },
  {
    "app_name": "bitgetTonWallet",
    "name": "Bitget Wallet",
    "image": "https://raw.githubusercontent.com/bitgetwallet/download/refs/heads/main/logo/png/bitget_wallet_logo_288_mini.png",
    "about_url": "https://web3.bitget.com",
    "deepLink": "bitkeep://",
    "bridge": [
      {
        "type": "js",
        "key": "bitgetTonWallet"
      },
      {
        "type": "sse",
        "url": "https://ton-connect-bridge.bgwapi.io/bridge"
      }
    ],
    "platforms": ["ios", "android", "chrome"],
    "universal_url": "https://bkcode.vip/ton-connect",
    "features": [
      {
        "name": "SendTransaction",
        "maxMessages": 4,
        "extraCurrencySupported": false
      }
    ]
  },
  {
    "app_name": "binanceWeb3TonWallet",
    "name": "Binance Wallet",
    "image": "https://public.bnbstatic.com/static/binance-w3w/ton-provider/binancew3w.png",
    "about_url": "https://www.binance.com/en/web3wallet",
    "deepLink": "bnc://app.binance.com/cedefi/ton-connect",
    "bridge": [
      {
        "type": "js",
        "key": "binancew3w"
      },
      {
        "type": "sse",
        "url": "https://wallet.binance.com/tonbridge/bridge"
      }
    ],
    "platforms":  ["ios", "android", "macos", "windows", "linux", "chrome"],
    "universal_url": "https://app.binance.com/cedefi/ton-connect",
    "features": [
      {
        "name": "SendTransaction",
        "maxMessages": 4,
        "extraCurrencySupported": false
      }
    ]
  },
  {
    "app_name": "okxWallet",
    "name": "OKX Wallet",
    "image": "https://static.okx.com/cdn/web3/assets/imgs/70d223c0-8527-40c1-8292-b3cc10b53d88.png",
    "about_url": "https://web3.okx.com",
    "universal_url": "https://web3.okx.com/download?appendQuery=true&deeplink=okxwallet://web3/wallet/tonconnect",
    "bridge": [
      {
        "type": "js",
        "key": "okxTonWallet"
      },
      {
        "type": "sse",
        "url": "https://web3.okx.com/tonbridge/discover/rpc/bridge"
      }
    ],
    "platforms": ["chrome", "safari", "firefox", "ios", "android"],
    "features": [
      {
        "name": "SendTransaction",
        "maxMessages": 4,
        "extraCurrencySupported": false
      }
    ]
  },
  {
    "app_name": "okxTonWallet",
    "name": "OKX",
    "image": "https://static.okx.com/cdn/web3/assets/imgs/be493af9-09fe-4e93-af0d-d6c4b040cea9.png",
    "about_url": "https://www.okx.com/web3",
    "universal_url": "https://www.okx.com/download?appendQuery=true&deeplink=okx://web3/wallet/tonconnect",
    "bridge": [
      {
        "type": "js",
        "key": "okxTonWallet"
      },
      {
        "type": "sse",
        "url": "https://www.okx.com/tonbridge/discover/rpc/bridge"
      }
    ],
    "platforms": ["chrome", "safari", "firefox", "ios", "android"],
    "features": [
      {
        "name": "SendTransaction",
        "maxMessages": 4,
        "extraCurrencySupported": false
      }
    ]
  },
  {
    "app_name": "hot",
    "name": "HOT",
    "image": "https://raw.githubusercontent.com/hot-dao/media/main/logo.png",
    "about_url": "https://hot-labs.org/",
    "universal_url": "https://t.me/herewalletbot?attach=wallet",
    "bridge": [
      {
        "type": "sse",
        "url": "https://sse-bridge.hot-labs.org"
      },
      {
        "type": "js",
        "key": "hotWallet"
      }
    ],
    "platforms": ["ios", "android", "macos", "windows", "linux"],
    "features": [
      {
        "name": "SendTransaction",
        "maxMessages": 4,
        "extraCurrencySupported": false
      }
    ]
  },
  {
    "app_name": "bybitTonWallet",
    "name": "Bybit Wallet",
    "image": "https://raw.githubusercontent.com/bybit-web3/bybit-web3.github.io/main/docs/images/bybit-logo.png",
    "about_url": "https://www.bybit.com/web3",
    "universal_url": "https://app.bybit.com/ton-connect",
    "deepLink": "bybitapp://",
    "bridge": [
      {
        "type": "js",
        "key": "bybitTonWallet"
      },
      {
        "type": "sse",
        "url": "https://api-node.bybit.com/spot/api/web3/bridge/ton/bridge"
      }
    ],
    "platforms": ["ios", "android", "chrome"],
    "features": [
      {
        "name": "SendTransaction",
        "maxMessages": 4,
        "extraCurrencySupported": false
      }
    ]
  },
  {
    "app_name": "safepalwallet",
    "name": "SafePal",
    "image": "https://static.safepal.com/safepal-logo-288.png",
    "about_url": "https://www.safepal.com",
    "universal_url": "https://link.safepal.io/ton-connect",
    "deepLink": "safepal-tc://",
    "bridge": [
      {
        "type": "sse",
        "url": "https://ton-bridge.safepal.com/tonbridge/v1/bridge"
      },
      {
        "type": "js",
        "key": "safepalwallet"
      }
    ],
    "platforms": ["ios", "android", "chrome", "firefox"],
    "features": [
      {
        "name": "SendTransaction",
        "maxMessages": 1,
        "extraCurrencySupported": false
      },
      {
        "name": "SignData",
        "types": ["text", "binary", "cell"]
      } 
    ]
  },
  {
    "app_name": "GateWallet",
    "name": "GateWallet",
    "image": "https://img.gatedataimg.com/prd-ordinal-imgs/036f07bb8730716e/gateio-0925.png",
    "about_url": "https://www.gate.io/",
    "bridge": [
      {
        "type": "js",
        "key": "gatetonwallet"
      },
      {
        "type": "sse",
        "url": "https://dapp.gateio.services/tonbridge_api/bridge/v1"
      }
    ],
    "platforms": ["ios", "android"],
    "universal_url": "https://gate.onelink.me/Hls0/web3?gate_web3_wallet_universal_type=ton_connect",
    "features": [
      {
        "name": "SendTransaction",
        "maxMessages": 4,
        "extraCurrencySupported": false
      }
    ]
  },
  {
    "app_name": "openmask",
    "name": "OpenMask",
    "image": "https://raw.githubusercontent.com/OpenProduct/openmask-extension/main/public/openmask-logo-288.png",
    "about_url": "https://www.openmask.app/",
    "bridge": [
      {
        "type": "js",
        "key": "openmask"
      }
    ],
    "platforms": ["chrome"],
    "features": [
      {
        "name": "SendTransaction",
        "maxMessages": 4,
        "extraCurrencySupported": false
      }
    ]
  },
  {
    "app_name": "BitgetWeb3",
    "name": "BitgetWeb3",